{
  "$schema": "https://json-schema.org/draft/2020-12/schema",
  "$id": "https://example.invalid/security-agent-suite/run-request.schema.json",
  "title": "CreateRunRequest",
  "type": "object",
  "additionalProperties": false,
  "required": [
    "request_id",
    "mode",
    "scope"
  ],
  "properties": {
    "request_id": {
      "type": "string",
      "minLength": 1,
      "maxLength": 128
    },
    "case_id": {
      "type": "string",
      "maxLength": 128
    },
    "mode": {
      "type": "string",
      "minLength": 1
    },
    "inputs": {
      "type": "array",
      "maxItems": 64,
      "items": {
        "type": "object",
        "additionalProperties": false,
        "required": [
          "type",
          "uri"
        ],
        "properties": {
          "type": {
            "type": "string"
          },
          "uri": {
            "type": "string",
            "format": "uri"
          },
          "sha256": {
            "type": "string",
            "pattern": "^[a-fA-F0-9]{64}$"
          },
          "media_type": {
            "type": "string"
          },
          "size_bytes": {
            "type": "integer",
            "minimum": 0
          },
          "metadata": {
            "type": "object",
            "additionalProperties": {
              "type": "string"
            }
          }
        }
      }
    },
    "scope": {
      "type": "object",
      "additionalProperties": false,
      "required": [
        "tenant_id"
      ],
      "properties": {
        "tenant_id": {
          "type": "string",
          "minLength": 1,
          "maxLength": 128
        },
        "authorization_ref": {
          "type": "string"
        },
        "assets": {
          "type": "array",
          "items": {
            "type": "string"
          }
        },
        "networks": {
          "type": "array",
          "items": {
            "type": "string"
          }
        },
        "domains": {
          "type": "array",
          "items": {
            "type": "string"
          }
        },
        "time_range": {
          "type": "object",
          "additionalProperties": false,
          "required": [
            "start",
            "end"
          ],
          "properties": {
            "start": {
              "type": "string",
              "format": "date-time"
            },
            "end": {
              "type": "string",
              "format": "date-time"
            }
          }
        }
      }
    },
    "policy": {
      "type": "object",
      "additionalProperties": false,
      "properties": {
        "network_access": {
          "enum": [
            "deny",
            "restricted",
            "allow"
          ]
        },
        "active_validation": {
          "type": "boolean"
        },
        "approval_id": {
          "type": "string"
        },
        "max_requests": {
          "type": "integer",
          "minimum": 0,
          "maximum": 1000
        },
        "max_duration": {
          "type": "string"
        }
      }
    },
    "output": {
      "type": "object",
      "additionalProperties": false,
      "properties": {
        "language": {
          "type": "string"
        },
        "formats": {
          "type": "array",
          "items": {
            "enum": [
              "json",
              "html",
              "docx",
              "pdf"
            ]
          },
          "uniqueItems": true
        }
      }
    },
    "metadata": {
      "type": "object",
      "additionalProperties": {
        "type": "string"
      }
    },
    "execution_mode": {
      "type": "string",
      "enum": [
        "",
        "automatic",
        "manual"
      ],
      "default": "automatic"
    },
    "input_manifest": {
      "$ref": "#/$defs/InputManifest"
    }
  },
  "description": "Normalized request schema. The API additionally enforces UTF-8 byte bounds, strict manual JSON, duration parsing, tenant context, and the lower configured body limit; see issue #70.",
  "$defs": {
    "InputManifest": {
      "type": "object",
      "additionalProperties": false,
      "required": [
        "schema",
        "sha256",
        "size_bytes",
        "media_type"
      ],
      "properties": {
        "schema": {
          "const": "sas.synthetic-alert/v1"
        },
        "sha256": {
          "type": "string",
          "pattern": "^[a-fA-F0-9]{64}$"
        },
        "size_bytes": {
          "type": "integer",
          "minimum": 1,
          "maximum": 1048576
        },
        "media_type": {
          "const": "application/json"
        }
      }
    }
  },
  "allOf": [
    {
      "if": {
        "required": [
          "execution_mode"
        ],
        "properties": {
          "execution_mode": {
            "const": "manual"
          }
        }
      },
      "then": {
        "required": [
          "input_manifest"
        ],
        "properties": {
          "mode": {
            "const": "triage"
          },
          "inputs": {
            "maxItems": 0
          },
          "policy": {
            "not": {
              "required": [
                "approval_id"
              ]
            },
            "properties": {
              "network_access": {
                "enum": [
                  "",
                  "deny"
                ]
              },
              "active_validation": {
                "const": false
              }
            }
          },
          "output": {
            "properties": {
              "formats": {
                "uniqueItems": true,
                "items": {
                  "enum": [
                    "json",
                    "html"
                  ]
                }
              }
            }
          },
          "metadata": {
            "maxProperties": 128,
            "propertyNames": {
              "minLength": 1,
              "maxLength": 128
            },
            "additionalProperties": {
              "type": "string",
              "maxLength": 4096
            }
          }
        }
      },
      "else": {
        "not": {
          "required": [
            "input_manifest"
          ]
        }
      }
    }
  ]
}
