{
  "request_id": "demo-traffic-001",
  "case_id": "CASE-DEMO-001",
  "mode": "analyze",
  "inputs": [
    {
      "type": "pcap",
      "uri": "artifact://uploads/demo.pcap",
      "sha256": "0000000000000000000000000000000000000000000000000000000000000000",
      "media_type": "application/vnd.tcpdump.pcap"
    }
  ],
  "scope": {
    "tenant_id": "default",
    "assets": [
      "10.10.10.25"
    ],
    "time_range": {
      "start": "2026-09-01T00:00:00Z",
      "end": "2026-09-01T02:00:00Z"
    }
  },
  "policy": {
    "network_access": "deny"
  },
  "output": {
    "language": "zh-CN",
    "formats": [
      "json"
    ]
  }
}
